ID,Question,A,B,C,D,Answer,Subject
23,当数据为区间型或比例型时使用参数检验。应该在何时使用单因素方差分析？,有 1 个 IV 以及 2 组以上的均值,有 2 个 IV 以及 4 组以上的均值,有 3 个 IV 以及 5 组以上的均值,有 4 个 IV 以及 6 组以上的均值,A,professional_psychology
25,下列哪项与智力发展模型结构无关：,投资理论,正向复写,G 理论,基本心理能力理论,A,professional_psychology
45,在一个新近建成的综合住房项目中，新老居民之间的对抗和敌意非常强烈。您作为该项目的顾问需要设计一项干预计划。目标是通过接触改善关系。为了让实现这一目标的可能性更大，您安排的互动应：,在最初安排比较随意的浅显接触，即提供“热身”阶段,提供让两个群体互动中隐含的地位阶层变得明确的机会,提供开展公开且全面讨论的机会，以便就每个群体认为对方存在的负面特质进行讨论,让每个居民群体都有否定另一个居民群体的负面特质的机会,D,professional_psychology
61,在卢因的力场理论中，组织计划变革涉及哪些阶段？,解冻、变革、再冻结,组成、执行、重新组成,识别、规划、行动,奠定基础、解决问题、达成一致,A,professional_psychology
76,阿尔伯特·艾利斯认为，我们对事件的情绪和行为反应是由我们对事件的信念所造成的，而不是事件本身的作用。也就是说，我们的信念是：,调节变量。,中介变量。,潜变量。,抑制变量。,B,professional_psychology
93,下列哪项不是可用于评估自杀风险的工具？,贝克绝望量表,贝克自杀意念量表,自杀行动问卷,自杀意念问卷,C,professional_psychology
108,_______ 是出生时大脑发育最不完善的区域。,脑干,大脑皮层,边缘系统,小脑,B,professional_psychology
166,定性研究获得的理论源于数据，而不是收集数据之前提出假设并帮助完善假设。根据您对此类研究的了解，下列哪项关于案例研究的陈述是不正确的？,案例研究用于确定态度测量、偏好和满意度,案例研究基于案例可以推广的假设,案例研究最有用的方面是作为试点研究确定可以以其他方式研究的变量,案例研究是对单个案例的详细调查,A,professional_psychology
211,“蔡加尼克效应”的基本前提是：,人们更容易记住未完成的任务，而不是已完成的任务。,人们更容易记住已完成的任务，而不是未完成的任务。,人们更容易记住困难的任务，而不是简单的任务。,人们更容易记住简单的任务，而不是困难的任务。,A,professional_psychology
279,脑脊液由 ___________ 分泌。,第三脑室,基底节,脉络丛,软脑膜,C,professional_psychology
291,脑性麻痹最常见的原因是,出生时受到外伤,硬脑膜出血,麻疹，伴发热,遗传（常染色体）性状,A,professional_psychology
310,一项研究采用修订版韦氏儿童智力量表 (WISC-R) 比较了学习障碍学生和正常学生在该量表十项测题上的表现。研究进行了十项单变量方差分析 (ANOVA) 来检验两组之间的差异，但使用多变量方差分析 (MANOVA) 是更好的选择，因为 MANOVA,通常可以更好地避免 II 类错误,不需要进行多重比较后续检验来解释显著效应,通常可以更好地避免 I 类错误,从概念和计算方面来看是一种更简单、更有效的方法,C,professional_psychology
409,失写症、失算症、手指失认症和左右混淆是下列哪种疾病的症状？,克雅氏病,艾迪生病,格斯特曼综合征,贾许温德症候群,C,professional_psychology
473,对特定治疗的评估未显示发挥了整体效果。然而，实验者确实发现精神障碍最严重的来访者出现显著改善，因此认为该治疗对极端案例是有效的。此结论,有效，前提是 t 检验显示严重精神障碍来访者与精神障碍程度较低的来访者之间的差异具有显著性,未考虑回归平均,未考虑历史和成熟变量,未考虑到严重精神障碍来访者中“安慰剂效应”最为明显的情况,B,professional_psychology
500,对于在发生车祸几个月后阅读有关车祸的报道而引起的焦虑，下列最恰当的描述是,中介类化,高级条件作用,潜在学习,反应形成,A,professional_psychology
503,谢尔登·史密斯医生在其商业伙伴退休后，成为了小镇上唯一的心理师，距离他最近的心理健康专家在 100 多英里外的小镇工作。史密斯医生有几位新的来访者遇到了他所受培训和经验有限的问题。此时史密斯医生应该：,拒绝为来访者提供治疗。,为这些来访者提供治疗，但只使用自身具备经验的干预措施。,为这些来访者提供治疗，并通过电话接受监督或获取咨询。,仅在这些来访者遇到危机时才同意为其提供治疗。,C,professional_psychology
508,狗嘴里的少许肉粉是巴甫洛夫的 ___________。,US,CS,UR,CR,A,professional_psychology
513,根据莫斯科维奇 (1985) 的观点，在下列哪种情况下，支持少数派立场的团体成员最有可能改变多数派的意见？,支持少数派立场的成员积累了“特异信任”。,支持少数派立场的成员在表达意见时始终如一且没有显得武断。,代表少数派的人数仅略少于代表多数派的人数。,多数派成员认为少数派领导人拥有法定性权力。,B,professional_psychology
523,在组织中，情感承诺水平对下列哪项的预测能力最低？,工作满意度,生产力,工作动机,离职率,B,professional_psychology
538,出生时大脑发育最不完善的区域是,视觉系统,皮层,脑干,小脑,B,professional_psychology
552,下列哪项与促进和改善健康的努力相关？,鼓励健康行为并针对社会问题进行公众教育,提高工作满意度、培养心理抗逆能力、建立自尊和社交技能、解决风险因素并鼓励健康行为,实施仅针对问题群体的健康倡导团体，并鼓励健康饮食,在肥胖问题上对公众进行倡导和教育,B,professional_psychology
570,治疗协议（或临时合同）是指建立正式的书面合同，其中指定靶行为以及强化物和立约人。以下哪个要素不是有效合同的要素？,关于治疗策略和预期结果的信息,能够监控的行为,引起来访者的参与,仅需要来访者最低限度的参与,D,professional_psychology
53,以下哪个形容词不能描述商务写作？,正式,摘要,个人,客观,C,public_relations
88,公司公共关系状况分析的“内部因素”部分通常包括,传播审计,战略建议,社区焦点小组,媒体联系人列表,A,public_relations
38,互联网对公共领域的影响：,通过只促进精英群体的利益抑制它,通过重申对言论自由的承诺恢复它的活力,通过强调与同龄群体的面对面接触再现它,利用一种更好的交流方式取代它,B,sociology
76,Smart 的著作表明：,男性和女性的暴力犯罪率相似,与男性相比，女性的性犯罪行为更有可能被正常化,妇女的犯罪行为往往反映了传统的性别角色,以上所有选项,C,sociology
93,博尔多（Bordo，1993） 等社会学家将西方文化中“流行的”厌食症归因于：,极其清苦、简朴的生活方式,情绪化、安于家庭生活、没有主见的传统女性形象,精神疾病的社会建构，“正常”行为模式由此被病态化,独立、自信的女性新理想，与成就和控制型文化价值观相结合,D,sociology
125,"帕克 (Parker,1976) 提出的“扩展模式”据说是：",文员和非熟练体力劳动者的生活方式，他们将闲暇时间视为摆脱异化工作的机会,专业人员和技术工人的特点，他们的工作兴趣延伸到休闲时间中,在工作和休闲之间保持平衡，既不相互联系，也不相互对立，半熟练体力劳动者和文员就是例证,学生倾向于将论文留到最后一刻再写，然后要求延长截止日期,B,sociology
136,在十九世纪的工人运动背景下，“并入”的含义是：,让工会代表参与政策决策过程,在国家和企业组织之间建立联系,招募女性从事全职有偿工作,将工人阶级组织纳入政治谈判和代表制度中,D,sociology
177,在十七、十八世纪的伦敦，由同性恋者组成的反主流亚文化被称为：,政客,莫莉,玩偶,罗莉,B,sociology
35,下列哪种 HPV 病毒已知会引起宫颈癌？,所有 5 个进化枝的病毒,14、16、18、31、45 型,本身均不具有致癌性,1-180 型,C,virology
61,如果人诺如病毒无法在细胞培养物中生长，那么该病毒的最佳研究方法是什么呢？,动物模型,志愿者研究,使用采用了复制子系统的细胞,从 3 种人 ORF 病毒基因组中推导,B,virology
63,请描述冠状病毒的结构。,棒状糖蛋白刺突穿过脂质双层,有包膜的二十面体结构,二十面体大多形性病毒,大的规则桶状病毒,C,virology
108,都市黄热病 (YF) 是什么？,城市中叮咬人类的蚊子的生命周期组成部分,森林地区叮咬人类和猴子的蚊子的生命周期组成部分,YF 病毒的一种突变体,已适应新蚊子的 YF 病毒种类,A,virology
119,有效监测系统要求包括：,诊断算法,人员组成,抽样框,以上均正确,D,virology
154,对于国际游客来说，最成功且使用最广泛的“旅行用”疫苗是什么？,流感,MMR,黄热病,狂犬病,B,virology
26,在希伯来语中，mashiach（弥赛亚）是什么意思？,救世主,上帝,先知,大卫的血脉,A,world_religions
66,《女诫》的作者是谁？,班昭,老子,孟子,刘襄,A,world_religions
69,在锡克教中，哪个词指神圣的秩序是 ell-embracing 的更高原则？,Sansar,Hukam,Mantar,Karam,B,world_religions
91,世界上最大的文庙网络在哪里？,印尼,中国,韩国,新加坡,C,world_religions
151,Vajrya 一词是指钻石，它代表了下面哪个词？,翡翠,聪慧,雷霆,闪电,C,world_religions
159,早上听古鲁的 Vak 是为了什么？,为锡克教社区以外的人祈祷,集体忏悔，净化社区,给人们一整天的冥想带来启示,对社区中的讨论进行教诲,C,world_religions
