ID,Question,A,B,C,D,Answer,Subject
91,社会生物学家认为，性的主要功能是：,快乐,生殖,维持双重标准,缓解紧张,B,human_sexuality
94,天主教会对人工节育的正式谴责是在_______的《人类生命》通谕中提出的。,教皇约翰二世,教皇保禄六世,教皇若望·保禄一世,教皇若望·保禄二世,B,human_sexuality
3,什么是“荷花号原则”？,所谓的“荷花号原则”是指 “不能因此推定对国家独立的限制”，或者，正如有人所解释的那样，“凡不为国际法所禁止的都是允许的”,所谓“荷花号原则”，即各国可自由选择他们将提交争议的法院,所谓“荷花号原则”是指不禁止各国在公海上行使执法管辖权,所谓“荷花号原则”是指源于国家惯例和法律确信的结合的习惯法,A,international_law
48,以下哪项描述了回避问题谬误？,认为某人应该做某事，只因为对他人怀有恶意,将对手的立场说得荒谬可笑,用与命题无关的证据或推理来支持主张，或通过转移话题来回应他人的论点,试图仅凭信息中激起的情感来达成一致,C,logical_fallacies
52,出现哪种谬误是因为没有认识到所提出的替代选择并非相互排斥？,乞题谬误,意外谬误,循环论证,虚假两难,D,logical_fallacies
100,通过法律来反对歧视是愚蠢的，因为我们的生活显然离不开歧视。我们在选择食物时会区分美味和难以下咽，在选择音乐时会区分悦耳和难听，在装饰家居时会区分和谐和不和谐的色彩，在选择朋友时会区分有趣和无趣的人，等等。我们的生活离不开辨别。,偏见性语言,含糊其辞,前后矛盾,稻草人,B,logical_fallacies
127,我们必须假定他是共产党员，因为他说他不是，而且我们知道，共产党员总是被教导要否认党员身份。,诉诸无知,肯定后件,否认前件,乞题谬误,B,logical_fallacies
18,对于多项式回归，以下哪一个结构假设最能影响欠拟合和过拟合之间的权衡：,多项式次数,我们是通过矩阵求逆还是梯度下降来学习权重,高斯噪声的假设方差,使用常数项单元输入,A,machine_learning
19,陈述 1| 截至 2020 年，一些模型在 CIFAR-10 上的准确率超过 98%。陈述 2| 原始 ResNet 未使用 Adam 优化器进行优化。,正确，正确,错误，错误,正确，错误,错误，正确,A,machine_learning
24,假设我们想对空间数据（例如房屋的几何位置）进行聚类。我们希望生成许多不同大小和形状的聚类。以下哪种方法最合适？,决策树,基于密度的聚类,基于模型的聚类,K 均值聚类,B,machine_learning
64,陈述 1| Word2Vec 参数未使用受限玻尔兹曼机初始化。陈述 2| tanh 函数是非线性激活函数。,正确，正确,错误，错误,正确，错误,错误，正确,A,machine_learning
73,给定两个布尔随机变量 A 和 B，其中 P(A) = 1/2、P(B) = 1/3 和 P(A | ¬B) = 1/4，P(A | B) 是多少？,1/6,1/4,3/4,1,D,machine_learning
79,陈述 1| 当训练数据集较小时，过拟合的可能性更大。陈述 2| 当假设空间较小时，过拟合的可能性更大。,正确，正确,错误，错误,正确，错误,错误，正确,D,machine_learning
80,陈述 1| 除了 EM，梯度下降还可用于对高斯混合模型进行推理或学习。陈述 2 |假设属性数量固定，基于高斯的贝叶斯最优分类器可以在与数据集中的记录数量成线性关系的时间内学习完成。,正确，正确,错误，错误,正确，错误,错误，正确,A,machine_learning
107,下列哪项关于卷积核的说法是正确的？,将图像与 $\begin{bmatrix}1 & 0 & 0\\ 0 & 1 & 0 \\ 0 & 0 & 1 \end{bmatrix}$ 进行卷积不会改变图像,将图像与 $\begin{bmatrix}0 & 0 & 0\\ 0 & 1 & 0 \\ 0 & 0 & 0 \end{bmatrix}$ 进行卷积不会改变图像,将图像与 $\begin{bmatrix}1 & 1 & 1\\ 1 & 1 & 1 \\ 1 & 1 & 1 \end{bmatrix}$ 进行卷积不会改变图像,将图像与 $\begin{bmatrix}0 & 0 & 0\\ 0 & 0 & 0 \\ 0 & 0 & 0 \end{bmatrix}$ 进行卷积不会改变图像,B,machine_learning
8,以下哪一项不是营销组合的要素？,促销。,产品。,目标市场。,定价。,C,marketing
12,如果中标人由于投标价格定得很低而获得一份他/她有义务交付的无利可图的合同，这种情况被称为：,胜者的诅咒。,胜者的价格。,胜者的奖励。,亏本促销定价。,A,marketing
55,____________在向目标受众传递信息方面非常有效，因为它允许以大多数其他媒体无法做到的方式进行解释。,数字。,印刷品。,广播。,户外。,B,marketing
75,为他人目的收集的二手数据被称为____________：,一手研究。,描述性研究。,因果研究。,二手研究。,D,marketing
108,心理细分基于：,消费者人口统计分析的定量方面。,消费者地理分析的定量方面。,个体居住模式与生命周期偏好。,根据人们的心理特征、价值观和生活方式进行分组。,D,marketing
171,一种商业活动，其中一方允许另一方有机会利用与目标受众的联系来换取资金、服务或资源，这被称为：,广告宣传。,交换。,赞助。,公共关系。,C,marketing
176,STP 过程的一个主要好处是：,将公司资源更有效和高效地匹配到具有最大 ROMI 前景的目标细分市场。,通过为营销策略提供方向和重点，增强公司的竞争地位。,通过识别新客户、增长细分或新产品用途，检查和识别市场中的增长机会。,以上都是。,D,marketing
195,以下哪一项不是制定 CSR 倡议的基本原理？,公司的责任不仅仅是为了盈利而生产产品。,公司拥有更广泛的利益相关者群体，而不仅仅是股东。,公司的影响仅限于简单的市场交易。,企业服务于更广泛的人类价值，而不仅仅是关注经济价值。,C,marketing
38,下列哪种情况不是家族性癌症综合征,家族性腺瘤性息肉病,利-弗劳梅尼综合征,冯·希佩尔-林道综合征,瓦登伯格综合征,D,medical_genetics
50,下列哪项属于 X 连锁显性遗传的特征？,双亲同血缘,雄性间遗传,仅由雌性遗传,仅由雄性遗传给雌性,D,medical_genetics
96,血氨水平高发生在：,半乳糖血症。,赫勒氏综合征。,鸟氨酰基转氨酶 (OTC) 缺乏症。,苯丙酮尿症。,C,medical_genetics
113,哪家快餐连锁店的广告语是“牛肉在哪里？”,温蒂汉堡,肯德基,汉堡王,麦当劳,A,miscellaneous
124,披头士最初把哪个城市称为家？,伦敦,利兹,利物浦,曼彻斯特,C,miscellaneous
146,警察用什么金属装置来固定屡次违章停车的车辆的车轮？,布鲁克林夹,丹佛锁扣,LoJack,The Club,B,miscellaneous
210,以下哪位民主党人在 1984 年的总统选举中输给了罗纳德·里根？,迈克尔•杜卡基斯,沃尔特·蒙代尔,加里·哈特,吉米•卡特,B,miscellaneous
305,在没有万能牌的游戏中，最大的一手牌是多少？,同花顺,皇家同花顺,葫芦牌,四条,B,miscellaneous
489,哪个词描述一个没有固定家园，到处流浪的部落？,游牧民族,卖弄学问,示意图,通便,A,miscellaneous
493,以下哪一种仪器是用来测量湿度的？,风速计,安培表,湿度计,气压计,C,miscellaneous
524,以下哪一种细菌在厌氧条件下会在食物中产生毒素？,肉毒梭状芽胞杆菌,破伤风梭菌,牛结核分枝杆菌,金黄色葡萄球菌,A,miscellaneous
545,以下哪一道不是传统的希腊菜？,寿喜烧,烤肉串,穆萨卡,腓尼基亚,A,miscellaneous
610,以下哪一项是关于一个公开上市的未来雇主的客观信息的最佳来源？,年度报告,新闻稿,报纸上的文章,向 SEC 提交的 10-K 文件,D,miscellaneous
636,下面哪一个不是矿物质？,石英,锂,钻石,方解石,B,miscellaneous
637,根据一个流行的儿童电视节目的标题，熊的大房子是什么颜色的？,红色,绿色,紫色,蓝色,D,miscellaneous
653,哪位女演员在电影《星际迷航 2：可汗之怒》中扮演尖耳朵的火神？,乌比·戈德堡,詹妮弗·格雷,柯斯迪·艾黎,海伦·亨特,D,miscellaneous
661,什么疾病会引起眼球内积液压力并损害眼球后部的视神经？,散光,白内障,青光眼,视网膜炎,C,miscellaneous
688,许多雇主依靠临时工在需求波动时提供灵活性。然而，雇用临时工的一个重要考虑因素是,他们与全职员工相比往往缺乏经验，而且对工作的专注投入也较少,他们在工作上的时间限制为 30 天，随后必须向他们提供永久职位,必须像正式全职员工一样向其提供医疗保健和其他福利,他们需要获得与做同样工作的正式全职员工相同的薪酬,A,miscellaneous
696,下面哪个不是纽约州的一个城市？,Perskippity,克洪克森,斯克内克塔迪,拉克万纳,A,miscellaneous
712,效忠誓词的最后一个单词是什么？,America,stands,indivisible,all,D,miscellaneous
719,一个典型的人的基因组中有多少对染色体？,1,23,88,7921,B,miscellaneous
727,根据传说，如果你给某人“邪恶的眼睛”，你在做什么？,诅咒他们,祝福孩子,数钱,消磨时间,A,miscellaneous
762,以下哪一种物品对去除墨渍有用？,小苏打,指甲油,发胶,黄油,C,miscellaneous
780,下面的商店中哪个不是 Gap 公司所有的？,Gap,Banana Republic,Old Navy,J Crew,D,miscellaneous
32,以下哪项是尿液中的主要含氮化合物？,尿酸,氨,尿素,肌酐,C,nutrition
84,呼吸商 (RQ)：,定义为 VO2 除以 VCO2 的比值。,采取高碳水化合物饮食时降低。,禁食时增加。,外源性碳水化合物转化为内源性脂肪时，超过 1.0。,D,nutrition
106,以下哪项因素不是进食障碍的危险因素,完美主义特征,女性性别,青春期节食,父母焦虑,D,nutrition
107,关于胃肠道 (GI) 吸收，以下哪项说法最正确？,葡萄糖吸收与钠摄取有关。,果糖吸收比葡萄糖更快。,在刷状缘膜上，吸收半乳糖和果糖的转运蛋白相同。,胃肠道水分吸收大部分发生在结肠。,A,nutrition
148,关于肠道在发生肥胖中的作用，以下哪种说法最能描述这种情况？,发生肥胖是因为肠道激素分泌紊乱，PYY 分泌未发出饱腹感信号。,肠道/大脑信号通路控制能量摄入在需求的 2% 以内，即使病态肥胖人群中也如此,问题是贪吃和暴食行为，即人们定期无视强烈饱腹感信号,即使在大量进餐后，美味、加工食品的美味信号也将压倒饱腹感信号，想要继续进食,B,nutrition
210,关于食物过敏，以下哪项是正确的：,如果不允许过敏物质超过规定的限度，则可以避免发生,是一种食物不耐受,通常仅发生在个体既往暴露致敏后,会引起不适，但通常很少引起医学担忧,C,nutrition
224,以下哪种说法是正确的？,"淀粉主要含有直链淀粉，为 α1,4-键连接果糖形成的聚合物","淀粉主要含有直链淀粉，为 α1,4-键连接葡萄糖形成的聚合物","淀粉主要含有直链淀粉，为 β1,4-键连接果糖形成的聚合物","淀粉主要含有直链淀粉，为 β1,4-键连接葡萄糖形成的聚合物",B,nutrition
284,证实糖摄入量与龋齿风险之间相关性的现有最佳证据来自哪种研究设计类型？,随机对照研究,非随机对照研究,横断面观察性研究,队列研究,D,nutrition
301,大多数发展中国家的农民是自给自足还是商业生产性农业呢？,几乎所有农民都是自给自足。,极少农民的生产是自给自足，绝大部分农民会在市场上销售他们几乎所有的产品。,几乎所有的小规模生产者会有一些自我供应，也会有一些产品在市场上销售。,37% 的农民纯粹自给自足。,C,nutrition
56,内格尔声称，道德运气的问题与以下问题密切相关：,上帝的存在,意志的自由。,心理利己主义。,共性。,B,philosophy
75,艺术的一个重要形式特征是_____。,社会意义,如实表述,它唤起强烈的情感的力量,一致性,D,philosophy
92,拜尔声称，道德怀疑主义通常是由于：,混乱的形而上学理论。,混乱的认识论理论。,混乱的宗教观。,混乱的科学理论。,B,philosophy
97,除了“这不是一件好事”这一事实外，欺骗参与者的一个重要的道德缺陷是什么？,这会损害研究人员及其学科的专业声誉。,这使得更加难以接触到离经叛道或隐藏的人群。,这意味着参与者的个人数据不能匿名。,以上都不是。,A,philosophy
143,帕菲特声称疼痛的程度：,可以精确地比较。,可以比较，但只能粗略地比较。,可以在个体内部比较，但不能在个体之间比较。,既不能在个体内部比较，也不能在个体之间比较。,B,philosophy
158,苏格拉底告诉克里托，当且仅当这样做_____时，他才应该尝试越狱：,对他有利。,对敌人不利，对朋友有利。,取悦诸神。,正义的。,D,philosophy
159,根据理想道德准则理论，一个人_____有义务去做理想道德准则所要求的事情：,在一个人的实际制度环境中。,在一个理想的制度环境中。,在一个没有制度的环境中。,在一个人人都能完美遵守这些规则的世界里。,A,philosophy
171,大多数采取外在主义方法来看待意义的人都是从_____角度来看待问题的。,世俗的,非宗教的,宗教的,务实的,C,philosophy
178,道德上不可能规则的一个例子是：,只要这样做对防止灾难是必要的就说谎。,永远做能带来最大快乐的事。,永远坚持你认为不正确的事情。,以上都是。,C,philosophy
260,根据洛克的观点，一个处于自然状态的人会把他的绝对自由交给国家，因为_____。,在服从国家时，他也将享有绝对的自由,在自然状态下，他对自由的享受是非常不确定和脆弱的,他想对别人拥有绝对的权力,他反对自然状态的法则,B,philosophy
11,现代非洲人没有任何尼安德特人的 DNA，这表明：,尼安德特人和解剖学上的现代人之间的基因流动一定发生在尼安德特人迁出非洲之前。,尼安德特人和解剖学上的现代人之间的基因流动发生在解剖学上的现代人走出非洲之后。,生活在非洲的尼安德特人并没有与解剖学上的现代人杂交，但一定是在现代人迁出非洲的时候跟随了他们。,解剖学上的现代人和尼安德特人之间从未发生过杂交。,B,prehistory
35,直立人的脸比现代人更________，但比能人更少。,晚熟,多毛,有枕骨,下巴突出,D,prehistory
103,为什么土耳其中部的恰塔霍裕克被视为一个大村庄，而不是一个城市？,这里没有宫殿，没有公共建筑，也没有什么地位分化的证据。,这里没有食物储存、驯养动物或建筑的证据。,这里没有与城市有关的艺术作品、仪式或活动。,这里没有纪念性建筑或道路的证据。,A,prehistory
134,许多古代精英对资源消耗的态度似乎是：,“省一分钱就是赚一分钱。”,“如果你拥有它，就炫耀它。”,“三思而后行。”,“后的必在前，前的必在后。”,B,prehistory
203,加速全球人口增长的粮食生产革命被称为________；它发生在_____年前。,"旧石器时代晚期过渡；在 35,000 年前","中石器时代人口转型；从 18,000 年前开始","新石器时代人口转型；从 11,000 年前开始","新石器时代革命；5,000 年后",C,prehistory
208,印加建筑以其_____而闻名：,木、土和石的结合,前所未有的规模和复杂程度。,精确的像拼图一样的石头砌筑。,使用拱形拱门。,C,prehistory
242,以下哪一项被描述为“现有原因的缓慢代理”？,自然选择,灾变说,均变论,单系进化,C,prehistory
276,与能人相比，是什么赋予了直立人迁徙如此之远、如此之快的能力？,性早熟,智力,两足行走,头小畸型,B,prehistory
26,关于《联邦失业税法》，下列哪项陈述正确？,无论原因如何，辞职的员工都有资格领取失业救济金。,联邦失业制度由雇主和员工税款共同资助。,该法案旨在帮助长期失业并需要援助以维持生计的工人。,失业保险制度由各州通过其就业法进行管理。,D,professional_accounting
60,关于股东查看公司账簿和记录的权利，下列哪项陈述正确？                                                        权利,是绝对的。,以要求检查的股东持有至少价值 5000 美元的股票为条件。,检查的要求需要出于适当的目的。,仅在被指控有欺诈或非法行为时存在。,C,professional_accounting
105,在审核非发行人的财务报表期间，会计员最不可能执行下列哪项程序？,询问管理层董事会会议上采取的行动。,研究预计符合可预测模式的财务报表要素之间的关系。,识别可能防止或发现重大错误的内部控制活动。,将财务报表与预算和预测中的预期结果进行比较。,C,professional_accounting
111,在编制由美国母公司及其外国子公司的合并财务报表时，外国子公司的功能货币是,子公司记账的货币。,子公司所在国家的货币。,母公司所在国家的货币。,子公司主要产生和支出现金的环境中的货币。,D,professional_accounting
113,Smythe Co. 投资 200 美元购买了 Gin Co. 0.50 美元面值普通股 100 股的看涨期权，当时市场价格为每股 10 美元。该期权在三个月内到期，行使价为每股 9 美元。初始投资时该看涨期权的内在价值是多少？,50 美元,100 美元,200 美元,900 美元,B,professional_accounting
143,"King Inc. 拥有 Simmon Co 70% 的流通普通股。King 的负债总额为 450,000 美元，Simmon 的负债总额为 200,000 美元。包含在 Simmon 财务报表中的是对 King 的一份 100,000 美元的应付票据。在合并财务报表中应报告的负债总额是多少？","520,000 美元","550,000 美元","590,000 美元","650,000 美元",B,professional_accounting
152,"在前一年的 5 月 1 日，Baker 购买了一项使用寿命为五年的设备，成本为 10,000 美元。Baker 采用修订快速成本回收制度（MACRS）折旧制度，没有使用任何特殊折旧扣除。在本年度的 3 月 1 日，Baker 出售了设备。五年期资产的 MACRS 折旧时间表如下：                                                
第一年 - 20.00%，
第二年 - 32.00%，
第三年 - 19.20%。
                                                  在本年度 Baker 可以扣除的折旧金额是多少？",533 美元,"1,600 美元","2,000 美元","3,200 美元",B,professional_accounting
183,"Dari Inc. 为关联方的债务提供了担保。12 月，Dari 获悉其大概率在接下来的六个月内需要支付介于 150,000 美元至 200,000 美元之间的款项以履行担保义务，但这一范围内任何金额的概率都差不多。Dari 应该在 12 月 31 日的资产负债表中应计的或有负债金额是多少？","200,000 美元","175,000 美元","150,000 美元",0 美元,C,professional_accounting
239,如果一家公司增发股本以获取现金，下列哪项比率或指标将受影响？                                                       总债务与总资产比率  营运资本,增加  增加,增加  减少,减少  增加,减少  减少,C,professional_accounting
23,一位 77 岁男性因为 12 小时的找词困难和右臂、右腿感觉和力量丧失的病史被带去就诊。他没有类似症状的病史。他患有 2 型糖尿病、高血压和心房颤动。目前正在服用二甲双胍、利尿酶蛋白和阿司匹林。他神智清醒。他的脉搏 80 次/分，不规则，呼吸 16 次/分，血压 170/90 mm Hg。他能遵循命令，但有非流畅性失语症。右上肢和下肢有中度无力和感觉减退。双侧深反射为 2+。右侧有巴宾斯基征。他的血清葡萄糖浓度为 162 mg/dL。下列哪项后续诊断最合适？,颈动脉双侧超声检查,头部 CT 扫描,脑电图 (EEG),腰椎穿刺,B,professional_medicine
26,一名 24 岁女性来医生处复诊。一周前，在快餐店工作时，她不慎将热油洒在左腿上，被送往急诊室治疗。左下肢检查显示一个 7 厘米的粉红色柔软颗粒状肿胀伤口。这种组织的形成最有可能由于下列哪种活性增加引起？,糖基化依赖性细胞粘附分子-1,P-选择素,溶基质素,血管内皮生长因子,D,professional_medicine
58,一个有脊柱裂的 35 岁男性因泌尿系统手术入院。他在日常生活活动中功能独立，并且在当地一家体育用品商店做库存管理工作。他通过定期自我导尿来保持控尿能力。患者截瘫，患有复发性草酸钙肾结石，最近因逼尿肌及膀胱颈功能障碍导致失禁。他的生命体征正常。体检显示他发育良好，营养良好，无急性痛苦表现。除了截瘫、下肢肌肉萎缩和下腹部手术疤痕外，体检未见异常。他在先前进行腹部结肠吻合术扩张膀胱功能手术时出现过一次由橡胶乳过敏引起的过敏反应。在照护此患者时，下列哪项考虑因素最重要？,使用一次性注射器注射药物,由外包公司准备食物,用于消毒床单的清洁剂类型,使用橡胶导尿管,D,professional_medicine
103,一名先前健康的 17 岁女孩因为 5 天来逐渐加重的下腹部疼痛、发热和阴道分泌物恶臭来到急诊室。初潮是 12 岁，上次月经是在 2 周前。她与一名男性伴侣有性行为，并使用综合避孕贴片。体温为 37.8°C（100°F），脉搏为 90 次/分钟，呼吸为 22 次/分钟，血压为 110/70 mm Hg。腹部检查显示双侧下腹部压痛严重。盆腔检查显示有化脓性宫颈分泌物，宫颈运动触痛和双侧附件区压痛。血红蛋白浓度为 10.5 g/dL，白细胞计数为 13000/mm³，血小板计数为 345000/mm³。尿妊娠测试呈阴性。下列哪种药物治疗最合适？,口服阿奇霉素,阴道克林霉素,静脉注射青霉素和万古霉素,肌内注射头孢曲松和口服多西环素,D,professional_medicine
120,一名 87 岁的女性在因糖尿病酮症酸中毒住院三天后，拒绝接受胰岛素注射。她说，她的身体状况已经恶化到她不再想要继续生活下去了；她几乎失明，并且可能需要双腿截肢。她报告自己一向是个积极的人，现在看不到自己的生活还有什么价值。她没有家庭，大部分朋友都病了或去世了。在精神状态检查中，她意识清楚并且配合。她准确描述了自己的病史并且了解拒绝胰岛素的后果。没有发现有抑郁症的证据。她拒绝医生试图改变她想法的任何尝试，认为医生太年轻，无法理解她的处境。她说，“我知道我会死，我就是想死。”下列哪项后续治疗最合适？,让患者签署“拒绝医疗建议”的表格后出院,寻求法院命令指定法定监护人,提供胰岛素但允许患者拒绝,转入精神病病房,C,professional_medicine
152,一名 29 岁女性来到急诊科，因为过去两天她的下腹部疼痛和恶心加剧。她性生活活跃且不使用任何避孕措施。她的最后一次月经在 6 天前结束。体温为 38.3°C（101.0°F）。体检显示双侧下腹部压痛伴反跳痛和腹肌紧张。盆腔检查发现宫颈口有白带，子宫触痛，附件区有压痛但未触及肿块。下列哪项是最合适的诊断研究？,宫颈培养,后穹窿穿刺术,腹腔镜检查,血清 β-hCG 浓度,A,professional_medicine
168,一名 29 岁女性因三叉神经痛被开具卡马西平。她有严重的骨质疏松症家族史。因此，医生还建议她增加维生素 D 的摄入量。这个建议最可能的原因是卡马西平可能影响下列哪个药代动力学过程？,吸收,分布,排泄,代谢,D,professional_medicine
180,一名 42 岁的女性在高速机动车碰撞事故后 10 分钟被带到急诊室，她当时是系安全带的乘客。抵达时，她呼吸困难并且腹痛。她的脉搏为 135 次/分，呼吸为 30 次/分，血压为 80/40 mm Hg。左侧肺底呼吸音减弱。胸部 X 光显示左下肺区不透光，膈肌阴影消失。插入胸管后有少量空气排出，随后排出绿色液体。下列哪项是最合适的后续管理措施？,腹部 CT 扫描,胸部 CT 扫描,胸腔镜检查,剖腹探查,D,professional_medicine
185,正在进行一项研究，以评估造船厂工人中的间皮瘤。一家大型造船厂提供了过去 50 年中所有员工接触石棉的记录。工人的健康保险公司提供的索赔数据记录了当前工人及退休人员的所有胸部 X 光片和间皮瘤的诊断。研究招募了被诊断为间皮瘤的造船厂工人和未被诊断为间皮瘤的造船厂工人。研究中的所有受试者都必须进行胸部 X 光检查。要选择一个进行过胸部 X 光检查的对照组，下列哪个理由最好？,解决混杂变量,证明因果关系,尽量减少评估偏倚,减少回忆偏倚,C,professional_medicine
242,一名 16 岁男孩因左侧胸部刀伤被送入急诊科。胸部 X 光显示左侧胸腔内有气液平面，左肺部分塌陷，胃泡抬高。纵隔在中线位置。下列哪项是最可能的诊断？,血气胸（无张力）,血胸（无张力）,气胸（无张力）,张力性血气胸,A,professional_medicine
271,一名 52 岁的男性在铲雪时发生胸痛并扩散至下颌，30 分钟后被送到急诊室。他的脉搏为 80 次/分钟，血压为 130/70 mm Hg。肺部听诊清晰。心脏检查显示 S4。在进行心电图检查时，患者表示感觉胸痛再次出现。最合适的立即治疗是使用下列哪种作用机制的药物？,增加 cAMP 浓度,增加一氧化氮浓度,抑制钾通量,抑制钠通量,B,professional_medicine
