ID,Question,A,B,C,D,Answer,Subject
123,"本问题涉及以下信息。
以下内容节选自一本小册子。
你要替我主持公道，记住，我一向坚决支持每个人有发表自己意见的权利，不管这种意见与我的意见有多么不同。凡是否认别人有这种权利的人，会使他自己成为现有意见的奴隶，因为他自己排除了改变意见的权利。
对付各种错误最强大的武器是理性。我从来没有使用过其他的武器，我相信我永远也不会使用。
现在法国已经完全废除了整个国家的教士制度，废除了与强制性的宗教制度和强制性的信条有关的一切，这种情况不仅促使我产生了这样的意图，而且使我非常有必要进行这样的工作，以免我们在迷信、虚假的政府制度和虚假的神学的普遍毁灭中，失去了道德、人性和真正的神学。
我只相信一个上帝，没有别的；我希望今生幸福。
我相信人的平等；我相信宗教的责任在于公正、仁爱和努力使我们的同胞幸福。
我不相信犹太教会、罗马教会、希腊教会、土耳其教会、新教教会，以及我所知道的任何教会所宣称的信条。我自己的思想就是我自己的教堂。
在我看来，所有国家的教会机构，无论是犹太教的、基督教的还是土耳其的，都只不过是人类的发明，它们的建立是为了恐吓和奴役人类，垄断权力和利益。
我发表这一声明，并不是要谴责那些持不同观点的人；他们和我一样有信仰的权利。
——托马斯·潘恩，《理性时代》，1794-1795 年
潘恩在最后一句中批评迫害的陈述，最有可能受到以下哪一项的影响？",洛克和卢梭提出的法律公平和个人权利的新概念,欧洲人通过贸易和旅行对丰富的文化多样性有了更深入的了解,以牛顿数学定律的发现为基础的确定性机械宇宙的新概念,挑战罗马天主教会对真理的垄断,B,high_school_european_history
133,"本问题涉及以下信息。
尽管国王陛下是且理应是英格兰国教的最高领袖，也理应得到全国神职人员的认可，然而，为了证实和确认这一点，为了在英格兰国教中增加基督信仰的美德，为了压制和根除迄今在英格兰国教中使用的一切错误、异端邪说和其他罪恶和滥用，无论是否由本届国会授权制定，国王、我们的最高统治者、他的继承人和继承者、这个王国的国王，将被认作、接受并被尊为英格兰教会（即圣公会）在地球上唯一的最高元首；并应拥有和享受附属于本王国的帝国王冠及其头衔和样式，以及属于和附属于同一教会最高元首的上述尊严的一切荣誉、尊严、卓越、管辖权、特权、权力、豁免、利润和商品；我们的君主、他的继承人和继承者、这个王国的国王，将有充分的权力和权威随时访问、压制、矫正、记录、命令、纠正、限制和修改所有这样的错误、异端邪说、滥用、冒犯、蔑视和暴行，无论它们是什么，其中根据任何形式的属灵权威或管辖权，它们应该或可以合法地改革、压制、命令、矫正、纠正、限制或修改，以最大程度地取悦全能的上帝，增加基督宗教的美德，并维护这个领域的和平、团结和安宁；尽管有任何用法、外国土地、外国当局、规定或任何其他与本协议相反的规定。
英国议会，《至尊法案》，1534 年
从这段话及其历史背景来看，人们可以推断该法案在某种程度上是",试图阻止新教在英国的传播,解决亨利八世的财政困难,试图使亨利八世唯一的继承人合法化,试图让英格兰与神圣罗马帝国结盟,B,high_school_european_history
151,哪个国家讲巴斯克语的人最多？,丹麦,芬兰,卢森堡,西班牙,D,high_school_geography
189,大不列颠的气候比同纬度的大多数其他地方温和，原因是什么？,湾流将温暖的海水带到大不列颠，提高了吹到岛上的风的温度。,遍布全国的温泉提高了周围土地和空气的温度。,大不列颠北部的山脉阻挡了从北极吹来的寒风。,小块陆地产生自己的局部气候，基本上不受纬度的影响。,A,high_school_geography
43,"假设存款准备金率为 10%。如果美国联邦储备委员会 (FED) 在公开市场操作中出售价值 2,900 万美元的政府证券，那么货币供应量会",增加 290 万美元。,减少 290 万美元。,增加 2.9 亿美元。,减少 2.9 亿美元。,D,high_school_macroeconomics
45,假设转移支付大于社会保障缴款、公司税和留存收益的总和。在这种情况下，,NDP 将大于 GDP。,NI 将大于 GDP。,PI 将大于 NI。,DPI 将大于 PI。,C,high_school_macroeconomics
61,政府使用以下哪项来衡量通货膨胀？,GNP,URL,CPI,FED,C,high_school_macroeconomics
88,一家公司想在国外市场上抢占市场份额，可以采取的策略是,提高其产品价格。,说服政府对产品征收进口关税。,说服政府对产品实行配额制。,倾销。,D,high_school_macroeconomics
121,经济中的自动稳定器在……方面发挥着重要作用。,延长商业周期,平衡预算,增加预算盈余,减轻经济衰退的影响,D,high_school_macroeconomics
123,为了使经济更接近充分就业，中央银行决定必须提高联邦基金利率。适当的公开市场操作是______，这将______货币供应量，______总需求，并抑制______。公开市场操作     货币供应量     总需求     抑制,购买债券     增加     增加     失业,购买债券     增加     增加     通货膨胀,出售债券     减少     减少     失业,出售债券     减少     减少     通货膨胀,D,high_school_macroeconomics
168,以下哪项不会使总需求曲线移动？,消费者信心的变化。,技术的变化。,货币供应量的变化。,州政府支出的变化。,B,high_school_macroeconomics
241,“挤出”效应是……的结果。,紧缩性财政政策导致利率下降,扩张性财政政策导致利率上升,扩张性货币政策导致利率上升,扩张性货币政策导致失业率上升,B,high_school_macroeconomics
264,以下哪项会限制中央银行实施扩张性货币政策的能力？,货币需求几乎完全具有弹性。,投资需求几乎完全具有弹性。,银行利用所有超额准备金发放贷款。,家庭持有的现金很少，他们将钱存放在支票和储蓄存款中。,A,high_school_macroeconomics
306,短期菲利普斯曲线说明了 ____ 和 ____ 之间的 ____ 关系。,价格水平 利率 负相关,利率 私人投资 负相关,通货膨胀率 失业率 负相关,价格水平 实际 GDP 正相关,C,high_school_macroeconomics
315,玉米在竞争性市场上进行交换。以下哪项肯定会提高玉米的均衡价格？,供给和需求曲线均向右移动。,供给和需求曲线均向左移动。,供给曲线向右移动；需求曲线向左移动。,供给曲线向左移动；需求曲线向右移动。,D,high_school_macroeconomics
317,以下哪项是美联储用来增加货币供应量的工具？,降低贴现率。,向商业银行出售国库券。,提高存款准备金率。,降低个人所得税率。,A,high_school_macroeconomics
329,滞胀是……的结果。,总供给曲线左移,总需求曲线左移,总供给和总需求曲线都左移,总供给曲线右移,A,high_school_macroeconomics
353,GDP 是衡量一个国家的 I. 生产水平。稳定性。III. 收入水平。,仅 I。,仅 II。,仅 III。,I 和 III。,D,high_school_macroeconomics
381,M1 和 M2 的区别在于，,M1 是第一抵押，而 M2 是第二抵押。,M2 是 M1 加上流动性更强的资产。,M2 包括储蓄存款。,M1 比 M2 大。,C,high_school_macroeconomics
71,\frac{-\frac{18}{7}}{-\frac{6}{5}} 是什么？,\frac{7}{15},\frac{15}{7},\frac{15}{8},\frac{15}{11},B,high_school_mathematics
201,袋子里有 4 个红色弹珠和 6 个蓝色弹珠。选择一个弹珠且不再放回，然后选择第二个。两个弹珠颜色相同的概率是多少？,\frac{1}{8},\frac{8}{15},\frac{1}{15},\frac{7}{15},D,high_school_mathematics
211,David 需要覆盖一个立方体的油漆量与表面积成正比。若 David 恰好可以用 16 夸脱的油漆完全覆盖一个边长为 2 英尺的立方体，则 David 用 169 夸脱的油漆可以覆盖多大的立方体（以英尺为单位的边长而言）？,\frac{13}{4},8,\frac{13}{2},13,C,high_school_mathematics
257,考虑两个小于 15 的正偶数（不一定不同）。当这两个数的和加上它们的乘积时，可能会有多少不同的值？,21,27,49,45,B,high_school_mathematics
4,外部性,会导致均衡价格被人为地抬高,会导致均衡价格被人为地压低,当市场无法达到均衡时就会存在,导致一种不能使社会总利益最大化的均衡,D,high_school_microeconomics
51,如果对葡萄的需求随着葡萄供给的增加而增加，我们可以说,均衡量上升，但价格变化不明确。,均衡量下降，但价格变化不明确。,均衡量上升，价格上升。,均衡量下降，价格下降。,A,high_school_microeconomics
70,假设在咖啡市场上设置了价格下限。这一政策的一个结果是,对咖啡冲泡机的需求减少。,市场上咖啡的持续短缺。,由于咖啡价格下降，消费者剩余增加。,对咖啡需求的增加。,A,high_school_microeconomics
173,以下哪一种商品的需求曲线可能最有弹性？,对白色福特厢式旅行车的需求,对汽车的需求,对福特汽车的需求,对美国制造汽车的需求,A,high_school_microeconomics
180,因为与收入相对较高的人相比，收入相对较低的人花在食品上的钱占收入的比例更大，那么食品销售税属于哪一类税？,累进税,比例税,累退税,中性税,C,high_school_microeconomics
227,宏观经济学关注的是,影响商业的政府及其法律。,个人和他们的资源使用。,公司和它们的生产水平。,整个国家的资源利用。,D,high_school_microeconomics
0,电容器充电后，两极板间的电势差为 5 V。如果电容为 2 mF，那么正极板上的电荷量是多少？,0.005 C,0.01 C,0.02 C,0.5 C,B,high_school_physics
96,有两个人，其中一个人的质量为 100 kg，另一个人的质量为 50 kg，他们面对面站在一个冰封的池塘（基本没有摩擦力）里。如果体重较重的人用力 F 推体重较轻的人，那么,体重较重的人受到的力是 (-1/2)F,此人受到的力是 -2F,体重较轻的人的加速度将是体重较重的人的加速度的一半,体重较轻的人的加速度将是体重较重的人的加速度的两倍,D,high_school_physics
10,大学理事会五月份举行的 AP 心理学考试是下列哪一种考试的典型例子？,资质,射影,成就,智力,C,high_school_psychology
20,以下哪一种测试最有可能是成就测试？,智商测试,对教科书中一章的课堂测试,法学院的入学考试,基于五大人格特质的人格测试,B,high_school_psychology
31,下列哪一项最直接地旨在帮助确定一项研究的发现是否反映了一个真正可复制的现象，而不是偶然过程的结果？,推论统计,描述性统计,标准差,外部变量,A,high_school_psychology
38,下列哪一项主要是一种化学感觉？,触觉,视力,味觉,听觉,C,high_school_psychology
179,在所有形式的心理治疗中使用的主要工具是什么？,与患者交谈,认知/行为干预,生物医学/认知治疗,体细胞治疗,A,high_school_psychology
208,精神活性物质是通过_____来改变意识的药物,刺激兴奋激素分泌到血液中的,模仿各种信息素的行为,促进或抑制突触上的神经传递,增加个体的催眠易感性,C,high_school_psychology
212,以下哪一种策略是全国学校心理学家协会 (NASP) 推荐的改善学校安全的最佳做法？,在轻微违纪后立即开除学生,执行严格的学生行为准则，例如零容忍政策,与家长沟通学校环境是安全的,建立一个学校安全和应急响应小组,D,high_school_psychology
241,大多数孩子会先发展下列哪一项技能？,用铅笔写字,用刀切,说一个句子,拍手,D,high_school_psychology
249,一位钢琴老师正在帮助一名学生学习一首新曲子。起初，她称赞学生弹奏正确的音符。在学生开始表现出对音符的熟练程度后，老师只有在学生在他演奏的片段中加入适当的动态和解释时才会表扬他。教师的教学方法是下列哪一种培训技术的一个例子？,负强化,负效惩罚,塑造,链锁化,C,high_school_psychology
344,神经传递通常被描述为一个电化学过程。以下哪一项与电气方面最直接相关？,突触,末梢按钮,激素,髓鞘,D,high_school_psychology
352,心理学领域产生于以下哪项？,生物化学,物理,哲学,跨文化人类学,C,high_school_psychology
416,承载意义的最小语言单位是,概念,单词,音素,语素,D,high_school_psychology
460,在使用了一家慈善机构寄来的地址贴纸后，Brittany 觉得有义务向发送地址贴纸的组织捐款。Brittany 的行为说明了,刻板印象,基本归因错误,单纯曝光效应,互惠规范,D,high_school_psychology
492,下列哪项最能说明敌意攻击？,一个男人打了他的妻子一巴掌，因为他的妻子又做了汉堡包当晚餐，这让他很生气。,一个环卫工人把一个空罐子扔到路边时撞倒了一些玫瑰花丛。,一位女服务员把一个托盘掉在地板上，摔碎了几个杯子和碟子。,一个粗心的司机撞了一个正在过马路的行人，使他受了重伤。,A,high_school_psychology
524,埃里克森的主动与内疚阶段与弗洛伊德的_____最密切相关,口腔期。,肛门期。,性器期。,性成熟期。,C,high_school_psychology
37,"一位店主收到几位顾客的投诉，说他的商店星期天不营业，于是他决定进行一次调查。他随机挑选了 100 名女性顾客和 120 名男性顾客，问他们：“你是否有兴趣星期天来这家店购物？”他计算了回答“是”的顾客的数量，并通过从星期日购物的男性顾客的比例中减去女性顾客的比例，构建了 95% 的置信区间。所得区间为 (–0.23, –0.18)。下列哪一项是对区间的正确解释？",我们有 95% 的信心，对周日购物感兴趣的女性比例超过了对周日购物感兴趣的男性比例。,我们有 95% 的信心，对周日购物感兴趣的男性比例超过了对周日购物感兴趣的女性比例。,我们有 95% 的信心，对周日购物感兴趣的女性比例等于对周日购物感兴趣的男性比例。,因为区间包含负值，所以它是无效的，不应该进行解释。,A,high_school_statistics
68,一位心理学家认为，在促进孩子的良好行为方面，对正确行为的积极奖励比对不良行为的惩罚更有效。制定了一份“正确行为”量表。μ1 = 接受积极奖励的儿童的“正确行为”等级，μ2 = 接受惩罚的儿童的“正确行为”等级。如果 H0: μ1− μ2= 0，那么下面哪一个是关于 HA 的正确说法？,HA: μ1− μ2> 0,HA: μ1− μ2< 0,HA: μ1− μ2≠ 0,上述任何一个都是给定 null 的可接受替代。,A,high_school_statistics
94,进行了一项研究，目的是确定更多的学业学习时数是否会导致篮球运动员得分更高。在对 50 名篮球运动员的调查中，人们注意到，25 名自称学习时间最多的人比 25 名学习时间较少的人平均得分更高。根据这项研究，教练开始要求球员花更多的时间学习。下列哪一项是正确的说法？,虽然这项研究可能有其缺陷，但它仍然证明了因果关系。,很可能有一个混淆变量对这种表面上的关系负责。,虽然这是一个对照实验，但教练的结论是不合理的。,为了让运动员更多地学习，让他们在球场上投入更多的练习时间来提高他们的平均得分会更有意义，因为更高的平均得分似乎与更多的学习时间有关。,B,high_school_statistics
5,"本问题涉及以下信息。
加纳市由两个城镇组成。其中一城镇由穆斯林居住，它有 12 座清真寺，有领薪水的伊玛目和宣礼员，还有法学家和学者。在周围有水井，井里有甘甜的水，人们用这些井来饮水和种植蔬菜…… 国王的翻译、掌管国库的官员和大多数大臣都是穆斯林。只有皇室成员才能穿缝制的衣服。所有其他的人都根据他们的手段，穿棉袍、丝绸或锦缎…… 国王把自己打扮得像个女人，脖子上戴着项链，前臂上戴着手镯…… 他坐…… 在一个圆顶的亭子里，周围站着十匹马。当自称与王信仰相同的人走近他时，他们就跪下，把尘土撒在头上，这是他们问候王的方式。至于穆斯林，他们只是用拍手来欢迎他。[人民的]宗教是异教和偶像崇拜……  每运来一驴盐，他们的国王就收取一金第纳尔，送出去时要收两金第纳尔。从一车铜中，国王应得的是五米卡尔，从一车别的货物中得十米卡尔…… 在他的国家所有的矿山中发现的金块都是为国王保留的，只有这些金粉留给人民。但为了这个，人们会积累黄金，直到它失去价值。在这个国家之外，还有一个叫马拉尔的国家，它的国王是虔诚的伊斯兰教徒，而他的王国的普通人仍然是多神教徒。从那时起，他们的统治者被授予穆苏尔玛尼的称号。
——11 世纪穆斯林历史学家和地理学家阿布·乌拜达拉·巴克里所著的《道路与王国之书》
文章中有什么证据表明加纳人直接或间接地参与了与亚洲的贸易？",他们在宫廷里养马，这些马可能来自蒙古人。,加纳国王继承了中国的磕头传统。,国王用黄金和珠宝装饰自己，可能来自印度。,朝廷里的人都穿着丝绸长袍。,D,high_school_world_history
60,"本问题涉及以下信息。
难道不是只有团结才能将我们凝聚成一支有效的力量，才能创造我们自己的进步，才能为世界和平做出我们宝贵的贡献吗？ 哪个独立的非洲国家将宣称其金融结构和银行机构已完全用于国家发展？ 哪个国家将声称其物质资源和人力可用于实现自己的民族抱负？ 我们正在迅速认识到，政治独立不足以让我们摆脱殖民统治的影响。我们一直忙于照顾各自独立的州，没有充分认识到联合的基本需要，这种需要植根于共同的目标、共同的规划和共同的努力。
加纳总统克瓦米·恩克鲁玛在非洲统一组织上的讲话，1963 年
在上面的文章中，说话者支持以下哪项事业？",民族主义,社会主义,泛非主义,新殖民主义,C,high_school_world_history
162,"本问题涉及以下信息。
“在过去，继滕克特里人之后，又出现了布鲁克特里人；但现在的一般说法是，卡马维人和盎格利瓦累人进入了他们的居住地，在[邻近]部落的共同帮助下，或出于对他们暴政的憎恨，或出于掠夺的吸引力，或出于上天对我们的[眷顾]，把他们赶了出去，并彻底消灭了他们。它甚至不吝惜让我们看到该冲突的壮观场面。六万多人倒下了，他们不是倒在罗马人的武器和兵器之下，而是远远地倒在我们欣喜的目光下。我祈祷，愿各部落即使不爱我们，至少也永远保持对彼此的恨；因为当帝国的命运催促我们前进时，幸运之神赐予我们的最大恩惠莫过于敌人之间的不和”。
日耳曼尼亚，普布利乌斯·科尔奈利乌斯·塔西陀，约公元 98 年
关于公元前 600 年至公元 600 年期间帝国对待“野蛮”（外来）民族的方式，以下哪个结论最直接地得到了这段文字的支持？",帝国鼓励敌对部落互相残杀，以减少对国家的威胁。,帝国欢迎野蛮民族的迁徙，将其作为军事力量或经济生产力的来源。,帝国用军事力量对付所有邻近的野蛮民族，以此来扩大自己的影响力。,帝国利用宗教改变野蛮民族的信仰，使他们对国家更加友好。,A,high_school_world_history
191,"本问题涉及以下信息。
加纳市由两个城镇组成。其中一城镇由穆斯林居住，它有 12 座清真寺，有领薪水的伊玛目和宣礼员，还有法学家和学者。在周围有水井，井里有甘甜的水，人们用这些井来饮水和种植蔬菜…… 国王的翻译、掌管国库的官员和大多数大臣都是穆斯林。只有皇室成员才能穿缝制的衣服。所有其他的人都根据他们的手段，穿棉袍、丝绸或锦缎…… 国王把自己打扮得像个女人，脖子上戴着项链，前臂上戴着手镯…… 他坐…… 在一个圆顶的亭子里，周围站着十匹马。当自称与王信仰相同的人走近他时，他们就跪下，把尘土撒在头上，这是他们问候王的方式。至于穆斯林，他们只是用拍手来欢迎他。[人民的]宗教是异教和偶像崇拜……  每运来一驴盐，他们的国王就收取一金第纳尔，送出去时要收两金第纳尔。从一车铜中，国王应得的是五米卡尔，从一车别的货物中得十米卡尔…… 在他的国家所有的矿山中发现的金块都是为国王保留的，只有这些金粉留给人民。但为了这个，人们会积累黄金，直到它失去价值。在这个国家之外，还有一个叫马拉尔的国家，它的国王是虔诚的伊斯兰教徒，而他的王国的普通人仍然是多神教徒。从那时起，他们的统治者被授予穆苏尔玛尼的称号。
——11 世纪穆斯林历史学家和地理学家阿布·乌拜达拉·巴克里所著的《道路与王国之书》
根据节选内容，下列哪一项正确描述了伊斯兰教在这一时期对非洲的影响？",伊玛目和宣礼师确保所有非洲人遵守伊斯兰法律。,一些精英皈依了伊斯兰教，但下层阶级仍保留着他们的传统信仰。,穆斯林商人拒绝与非穆斯林做生意。,非洲国王要求穆斯林在宫廷中遵守异教习俗。,B,high_school_world_history
214,"本问题涉及以下信息。
“然后，万王之王沙普尔去世了。后来，他的儿子万王之王霍尔密兹德登基，统治了整个帝国。万王之王霍尔密兹德授予我帽子和腰带，并为我创造了更高的地位和尊严，在朝廷中，在一个又一个王国，一个又一个地方，在整个帝国中，他给了我更多的权威和权力，在神圣的事务上，并为我创造了“克尔迪尔，阿胡拉马自达的[首席祭司]”的头衔，以阿胡拉马自达神的名字命名。于是，在一个又一个王国，一个又一个地方，举行了许多盛大的神圣仪式，建立了许多沃勒姆之火，许多魔法师变得幸福和繁荣，许多火焰和魔法师被封为皇帝……
然后万王之王霍尔密兹德去世了。万王之王巴兰，万王之王沙布珥的儿子，万王之王何米施的兄弟，起来治理帝国。万王之王巴兰在朝廷中，在一个又一个的王国里，在一地接一地，都给了我很高的荣誉和尊严，赐给我权柄和能力，使我可以为神作各样的事。于是，在一个又一个王国，一个又一个地方，举行了许多盛大的神圣仪式，建立了许多沃勒姆之火，许多魔法师变得幸福和繁荣，许多火焰和魔法师被封为皇帝……
在一个又一个王国，在整个帝国的一个又一个地方，阿胡拉·马自达和众神的仪式变得卓越，马兹达尼亚的宗教和帝国的法师们获得了极大的尊严，帝国的众神、水、火和小牲畜获得了极大的满足，而阿里曼[阿胡拉马自达的邪恶对手]和恶魔受到惩罚和谴责，阿里曼和恶魔的教义离开了帝国，被抛弃了。帝国内的犹太教徒、佛教徒、印度教徒、纳索罗教徒[东正教]、基督教徒、马克塔克教徒[浸信会教徒]和摩尼教徒都受到了打击，他们放弃了摧毁偶像、驱散恶魔和神座的储藏和巢穴。”
摘自公元三世纪晚期波斯 Naqsh-e-Rustam 的 Kerdir 铭文
以下哪一项最好地解释了萨珊波斯境内佛教社区的存在？",波斯人使人们远离佛教的努力激发了更多的追随者。,佛教的启示动摇了波斯的皈依者。,波斯的地理位置横跨与印度的国际贸易路线。,琐罗亚斯德教对佛教徒给予了有限的宽容。,A,high_school_world_history
6,随着年龄的增长，眼球晶状体通常不会发生以下哪种情况？,变厚,变黄,变浑浊,充满液体,D,human_aging
20,高水平的自我保健行为与水平的__________有关,神经质,外向性,宜人性,二级控制,C,human_aging
44,根据祖父母的报告，作为祖父母最有成就感的方面不是以下哪一项？,不朽的感觉,宠爱孙辈,有人伺候,回忆起他们还是孙辈时的情景,C,human_aging
78,具有以下哪种控制形式的人最不可能在其居住地遇到无障碍问题？,外部,内部,初级,全面,B,human_aging
88,“队列”一词是指,一个人的实际年龄,经历过重大事件的一代人,一个人的性别,生活在同一文化中的一群人,B,human_aging
158,对于老年学研究人员来说，以下哪项是最重要的变量？,年龄,性别,队列,测量时间,A,human_aging
48,罗马天主教认为下列哪种行为有罪,同性恋行为,婚姻外的异性恋行为,服用避孕药,以上均正确,D,human_sexuality
78,异性恋者的性幻想永远不会涉及_________，而同性恋者的性幻想永远不会涉及__________。,无论异性恋还是同性恋的性幻想都可能涉及同性或异性,异性；同性,同性；同性,同性；异性,A,human_sexuality
